{
  "id": "the-magic-of-the-indian-monsoon",
  "name": "The Magic of the Indian Monsoon! 🌧️",
  "description": "How the Indian monsoon works, its seasons, and its impact.",
  "author": "OpenEdu Course Creator",
  "license": "CC-BY-SA-4.0",
  "languages": ["en"],
  "tags": ["monsoon", "india", "climate"]
}
